<?xml version="1.0" encoding="UTF-8"?>


<!DOCTYPE OrderDetail SYSTEM 'reviewOrder.dtd'>

<OrderDetail>
    <Record recordID= "ORD1">
        <orderID></orderID>
            
        
            <userID> </userID>
           
            
            <orderDate></orderDate>
            <Pickup></Pickup>
            <DeliveryAddress></DeliveryAddress>
            <RequiredDate></RequiredDate>
            <TotalAmount></TotalAmount>
            <Status></Status>
    </Record>                              
 
</OrderDetail>
